{
  "E_dct_proof_prototype_maturity_gates": [
    "DCT document exists",
    "DCT code exists",
    "DCT test exists",
    "source provenance verified",
    "privacy gate passed",
    "license gate passed",
    "human review queued",
    "human review passed",
    "no outreach flag set",
    "schema validation passed",
    "local no-network CI passed",
    "public summary generated",
    "private review note generated",
    "prototype brief generated",
    "simulation plan generated",
    "benchmark plan generated",
    "rollback plan exists",
    "audit receipt exists",
    "risk score below threshold",
    "power score above threshold",
    "dataset linked",
    "funding program linked",
    "municipal need linked",
    "university lab linked",
    "industry cluster linked",
    "AI-7 project linked",
    "TFUGA link documented",
    "Yggdrasil node created",
    "hyperedge proof created",
    "counterexample search planned",
    "falsifiability matrix created",
    "stakeholder map generated",
    "impact metric defined",
    "energy impact metric defined",
    "water impact metric defined",
    "climate impact metric defined",
    "materials impact metric defined",
    "education impact metric defined",
    "prototype feasibility checked",
    "deployment surface selected",
    "web route candidate",
    "educational quest candidate",
    "cloud preview candidate",
    "Drive dossier candidate",
    "GitHub issue candidate",
    "GitHub PR candidate",
    "read-only ingestion only",
    "manual deploy only",
    "secrets check passed",
    "workflow check passed",
    "Vercel check green or isolated",
    "canon seed",
    "canon candidate",
    "canon verified",
    "canon crystallizable",
    "canon stable",
    "archive low value",
    "reject privacy risk",
    "reject license ambiguity",
    "request source refresh",
    "request domain expert review",
    "ready for public preview",
    "ready for pilot",
    "ready for production review",
    "freeze release"
  ],
  "count": 64,
  "axis_name": "E",
  "axis_role": "DCT / proof / prototype / maturity gates",
  "total_tensor_size_with_existing_axes": 1073741824
}
